<?xml version="1.0" encoding="UTF-8" standalone="no" ?>
<!DOCTYPE studentList SYSTEM "studentList.dtd">
<studentList>
  <student>
    <firstName>John</firstName>
    <lastName>Smith</lastName>
    <email>jsmith@gmail.com</email>
  </student>
  <student>
    <firstName>Mary</firstName>
    <lastName>Jane</lastName>
    <email>mjane@gmail.com</email>
  </student>
</studentList>
